{
  "schema_version": 1,
  "repository": "TrillionniumFoundation/hepta-glasses",
  "head_commit": "0000000000000000000000000000000000000000",
  "source_tree": "0000000000000000000000000000000000000000",
  "artifact_name": "hepta-source-evidence-0000000000000000000000000000000000000000",
  "artifact_sha256": "0000000000000000000000000000000000000000000000000000000000000000",
  "artifact_size_bytes": 1,
  "archive_object": "sha256:0000000000000000000000000000000000000000000000000000000000000000",
  "archived_at": "1970-01-01T00:00:00Z",
  "retention_until": "1970-01-01T00:00:01Z",
  "custodian": "REPLACE_WITH_EXTERNAL_CUSTODIAN",
  "key_id": "REPLACE_WITH_EXTERNAL_KEY_ID",
  "signature": "AAAAAAAAAAAAAAAAAAAAAAAAAAAAAAAAAAAAAAAAAAAAAAAAAAAAAAAAAAAAAAAAAAAAAAAAAAAAAAAAAAAAAA=="
}
